PPID,Post-processing
ABIQ,"In the first round, 20 μg CBECD was incubated in a polystyrene tube overnight at 4°C on a nutator. The isolated phage were pre-incubated in a casein blocked polystyrene tube to remove peptide-phage that bound to casein or polystyrene. The pre-cleared phage not bound to the casein/polystyrene tube were then added to the tube coated with CBECD and incubated on a nutator for 2 hr at room temperature. The non-bound phage were washed from beads by washing 5 times with PBS containing PPI. Another one round of screening was performed."
ABIR,"After this first round of‘positive' selection with IAA sera, 'negative' selection was achieved whereby phages not specifically reactive with IAA sera were removed using 100 μg of IgG prepared from pooled normal sera. The amplified eluate was enriched by two further rounds of positive selection, negative selection, and amplification."
ABIS,Each round of panning was performed on streptavidin-coated wells of a 96-well enzyme-linked immunosorbent assay plate.
ABIT,Each round of panning was performed in the absence of 17β-estradiol.
ABIU,Each round of panning was performed in the presence of 17β-estradiol.
ABIV,Biotinylated ERα LBD or biotinylated ERα FL was immobilized on a neutravidin-coated microtiter plate well. Each round od panning was performed on neutravidin-coated microtiter plate well.
ABIW,The target was biotinylated. Each round of panning was performed on streptavidin-coated Immulon 4 plates.
ABIX,The real target is ERβ treated with 4-hydroxytamoxifen. The target was biotinylated. Each round of panning was performed on streptavidin-coated Immulon 4 plates.
ABIY,"The real target is ERβ treated with ICI 182, 780. The target was biotinylated. Each round of panning was performed on streptavidin-coated Immulon 4 plates."
ABIZ,"For the first round of selection, 50 μl of streptavidin-coated magnetic beads were incubated with 100 μl of 5 μM biotinylated protein G for 1 hr at room temperature with agitation. In subsequent rounds of selection, 10 μl of streptavidin beads and 0.05 μM of biotinylated protein G were used. The streptavidin bead/biotinylated protein G complex was combined with the phage/antibody mixture and incubated."
ABJA,"In the first round, the mAb was incubated at 1 μM concentration overnight at 4°C with 1.0e10 Amp(R) tranducing unit (TU) of library in a total volume of 10 pl. The mixture was incubated with 0.25 μg of a biotin-conjugated goat antimouse IgA secondary antibody ((α-chain specific), which was previously pre-adsorbed overnight at 4°C with 2.0e11 phage particles of UV-killed M13K07 to prevent nonspecific binding, and then the phage-mAb-secondary Ab complexes were tethered on streptavidin-coated dishes. The second round of affinity selection was carried out in the same way, but using 10 nM or 0.1 nM concentrations of mAb and proportionally lower amounts of the secondary antibody."
ABJB,"In each biopanning round, an adult obese leptin-deficient [Lep(ob/ob)] female mouse was injected intravenously through the tail vein with 1.0e10 transducing units (TU) of the library. Phage (～300 TU/g in round 1 increased to ～e4 TU/g in round 3) were recovered after 5 min of circulation from subcutaneous fat and bulk-amplified for each subsequent round. Phage amplified after the third round of panning were enriched for fat-specific binders by adapting an in vivo subtraction step: a lean, C57BL/6 female was injected intravenously with 1.0e9 TU of phage selected in round 3. After 5 min, the unbound phage were recovered from circulation and amplified for the fourth and final round of biopanning in a Lep(ob/ob) female mouse."
ABJC,The phages bound specifically to the actin-binding site of angiogenin were competitively eluted with bovine actin.
ABJD,"Platelets were mixed with phage particles. After several cycles of washing, the resulting platelet/phage pellet was resuspended in PBS, milk containing SFLLRNPNDKYE (thrombin receptor activating peptide)."
ABJE,"The real target is thrombin receptor on platelets. Platelets were mixed with phage particles. After several cycles of washing, the resulting platelet/phage pellet was resuspended in PBS, milk containing SFLLRNPNDKYE (thrombin receptor activating peptide)."
ABJF,"Calmodulin was coupled to CNBr-activated Sepharose 4B (1 mg of protein/ml of resin). An aliquot (e12 pfu) of the random sequence bacteriophage library containing 1 mM CaCl2, was applied to a column of calmodulin-Sepharose. The column was then washed successively with sterile column buffers containing 1 mM CaCl2, then 1 mM CaCl2 and 1 M NaCl, and eluted with the calcium chelator, 1 mM EGTA and 1 M NaCl.  The EGTA-eluted bacteriophage were amplified. An aliquot of the amplified bacteriophage was reselected two times."
ABJG,CaM (0.2 μg/well) was immobilized to 96-well polystyrene microtiter plates by non-specific absorption in 0.1 M NaHCO3 (pH 8.5).
ABJH,"CaM (0.2 μg/well) was immobilized to 96-well polystyrene microtiter plates by non-specific absorption in 0.1 M NaHCO3 (pH 8.5). Biotinylated CaM (0.2 μg/well) was immobilized using streptavidin (0.5 μg/well) absorbed as above. For libraries screening, e11 phage particles were incubated with immobilized CaM, non-binding phage washed away, binding phage recovered by acid elution and amplified in E. coll. Three rounds of screening were performed."
ABJI,"Prior to panning with the virus, the phages were incubated for 1 h at 4°C in BSA-coated wells in 500 ml of Tris-buffered saline supplemented with 1 mg/ml BSA and 0.5 mM MgCl2."
ABJJ,"Paramagnetic beads were precoated with a goat anti-human Fcλ-specific antibody and incubated (2 h at room tmeperature) with patient plasma (1:100). Beads were washed six times with PBS/0.25% gelatine/0.1% Tween-20 and rotated overnight at 4°C with 10 μL (1.5e11–2e11 particles) of the original phage peptide libraries. The next day, beads were washed extensively with PBS/0.25% gelatine/0.1% Tween-20 and the bound phages were eluted by pH shift [0.2 Mglycine-HCl (pH 2.2)/1 mg/mL BSA], neutralized with 1 M Tris-HCl (pH 9.1) and used for a negative selection with an HIV-negative plasma pool as described above. Supernatants of the negative selection were amplified and used for a second and third round of selection."
ABJK,The panning experiment was carried out with the library packed in the absence of IPTG.
ABJL,"The panning experiment was carried out with the library packed in the presence of IPTG, which increased the number of fusion P8 protein copies on each phage particle as a consequence of Lac induction."
ABJM,The phages were propagated in the absence of IPTG to obtain medium peptide display level and allow the selection of a wider range of interacting sequences.
ABJN,Screening of the phage library was performed by the BRASIL method.
ABJO,"Three rounds of subtractive screening of a phage peptide library were performed using Eca109 as the target cells and normal human esophageal epithelial cells as the absorber cells. For the second and third rounds of selection, the volume of added phage remained the same, yet the incubation time with the Eca109 cells decreased to 45 min and 30 min, respectively. In contrast, the incubation time with the normal esophageal cells increased to 1.25 h and 1.5 h, respectively."
ABJP,Two rounds of negative panning followed the six rounds of positive screening procedure. The collected phages from the final round of positive panning were incubated in a microcentrifuge tube filled with Binding Buffer lacking BPA for 1 h and centrifuged as above in order to exclude phage particles with cross binding affinity to the tube surface.
ABJQ,"In the first round of affinity selection, microtiter wells were coated with purified sera IgG from patients without PMI to absorb nonspecific phages from the phage peptide library, and the unbounded phages were then incubated with sera IgG from patients with PMI to screen for phages containing potential peptide biomarkers. Another two rounds of affinity selection were carried out in the same way."
ABJR,Ultimately phage clones were obtained in elution step with polyclonal HAv anti-β2GPI antibody.
ABJS,Ultimately phage clones were obtained in elution step with monoclonal chimeric IgG anti-β2GPI antibody (HCAL).
ABJT,Ultimately phage clones were obtained in elution step with polyclonal LAv anti-β2GPI antibody.
ABJU,The screen was designed to identify peptides that bind to multilamellar vesicles (MLVs) at pH 5.
ABJV,Three to four rounds of panning were performed for each substrate. The entire experiment was repeated 3 times.
ABJW,"Two rounds of positive selection, followed by two rounds of negative selection, followed by a final positive selection were performed. Negative selection was performed on a complementary substrate, in this case a germanium wafer."
ABJX,"To isolate phage that home to SCCs in K14-HPV16 mice, two rounds of ex vivo and two rounds of in vivo selection were performed on tumors histologically confirmed as squamous cell carcinoma grades Ⅱ-Ⅳ."
ABJY,"In the first round, mdx mice were injected with 2e11 phage particles in PBS each via tail vein injection under anesthesia and sacrificed 2 h later. The heart was harvested. The phage particles homing to the heart muscle were harvested. For round 2 and 3 of the selection, 2e10 and 2e9 phage harvested from the heart muscle was injected into mdx mice respectively. For the last selection, heart tissue was also taken and phage within were amplified."
ABJZ,"In the first round, mdx mice were injected with 2e11 phage particles in PBS each via tail vein injection under anesthesia and sacrificed 2 h later. The heart was harvested. The phage particles homing to the heart muscle were harvested. For round 2 and 3 of the selection, 2e10 and 2e9 phage harvested from the heart muscle was injected into mdx mice respectively. For the last selection, liver tissue was also taken and phage within were amplified."
ABKA,"In the first round, mdx mice were injected with 2e11 phage particles in PBS each via tail vein injection under anesthesia and sacrificed 2 h later. The quadriceps was harvested. The phage particles homing to the quadriceps muscle were harvested. For round 2 and 3 of the selection, 2e10 and 2e9 phage harvested from the quadriceps muscle was injected into mdx mice respectively. For the last selection, quadriceps tissue was also taken and phage within were amplified."
ABKB,"In the first round, mdx mice were injected with 2e11 phage particles in PBS each via tail vein injection under anesthesia and sacrificed 2 h later. The quadriceps was harvested. The phage particles homing to the quadriceps heart were harvested. For round 2 and 3 of the selection, 2e10 and 2e9 phage harvested from the quadriceps muscle was injected into mdx mice respectively. For the last selection, liver tissue was also taken and phage within were amplified."
ABKC,The binding of the anti-total PSA mAb 8F8G5 to PSA was found to enhance the enzymatic activity of the bound PSA. Therefore the library was screened with PSA immobilized into microtiter wells coated with anti-total PSA mAb 8F8G5.
ABKD,The dodecapeptide library was screened with PSA immobilized into microplate wells coated with anti-total PSA mAb 11E5C6.
ABKE,The CX7C phage library cyclized with BSBBA was subjected to two consecutive selection rounds against streptavidin as follows. The population was first depleted of trans binders by adding and discarding 7 times 10 μL magnetic streptavidin beads. The remaining phage were exposed 5 min to the UV light and incubated with 20 μL magnetic streptavidin beads to capture cis binders. Binders were eluted by addition of biotin and buffer with a low pH.
ABKF,The phage-peptides were not cyclized with BSBBA and exposed to UV light. The population was first depleted of trans binders by adding and discarding 7 times 10 μL magnetic streptavidin beads. The remaining phage were exposed 5 min to the UV light and incubated with 20 μL magnetic streptavidin beads to capture cis binders. Binders were eluted by addition of biotin and buffer with a low pH.
ABKG,The XCX5CX phage library cyclized with BSBBA was subjected to two consecutive selection rounds against streptavidin as follows. The population was first depleted of trans binders by adding and discarding 7 times 10 μL magnetic streptavidin beads. The remaining phage were exposed 5 min to the UV light and incubated with 20 μL magnetic streptavidin beads to capture cis binders. Binders were eluted by addition of biotin and buffer with a low pH.
ABKH,The negative selection for depletion of trans binders was omitted. Binders were eluted by addition of biotin and buffer with a low pH.
ABKI,The phage-peptides were not cyclized with BSBBA and exposed to UV light. The negative selection for depletion of trans binders was omitted. Binders were eluted by addition of biotin and buffer with a low pH.
ABKJ,"Screening of the phage library was performed by the BRASIL method, which allows the separation of cell-bound from unbound phage in one step."
ABKK,"Each biopanning round consists of negative selection or sub-traction of phages that nonspecifically binds to the Dynabeads and subsequent positive selection of phages that binds to myoglobin. In the negative selection, phage library in PBS was added to the BSA-blocked Dynabeads and incubated to subtract the phages that binds to the beads."
ABKL,"During the first panning, an immunotube (Nunc) was coated overnight with 5 μg/mL of anti-TsCa IgG. In the second panning, 1 μg/mL of anti-TsCa IgG was used for coating, with 0.5 μg/mL in the subsequent pannings. Affinity-selected phagedisplayed peptides were obtained by competition assay after incubation at room temperature for 90 min with TsCa at a concentration 100 times higher than that of bovine IgG."
ABKM,Round 1 of panning is performed against H1299 nonsmall cell lung cancer cells. The output of round 1 is then split into two groups. H1299 NSCLC cells of this group remains untreated with chlorpromazine.
ABKN,Round 1 of panning is performed against H1299 nonsmall cell lung cancer cells. The output of round 1 is then split into two groups. This group is then incubated with H1299 NSCLC cells treated with chlorpromazine.
ABKO,The library was pre-cleared from vasculature and non-tumor target binding phage according to previous methods. The pre-cleared phage library was screened against xenografted human OC SKOV-3 tumors in mice.
ABKP,"A negative selection was performed before every biopanning round. In the negative biopanning, the library was added to BSA-coated wells. Then the supernatant was transferred to target-coated wells. After the fourth round, binding phages were eluted and used for a further negative selection against HEp-2 cell lysate."
ABKQ,"The phage library first incubated with IgGs from healthy dogs. The supernatant containing the clones that were not adhered to the IgGs was recovered and transferred to a new tube, and this procedure was repeated for three times. Then, the supernatant incubated with IgGs purified from asymptomatic CVL. The bound phage clones were transferred to a new tube containing the IgGs purified from asymptomatic CVL, and the process was repeated for three times. After this, the recovered phage clones were transferred to a new tube containing the IgGs that had been purified from symptomatic CVL, and the process was also repeated for three times."
ABKR,"In the first round, the rats (n = 3) were injected intravenously (iv) with e12 pfu of the library suspended in 100 μl TBS. The phage was allowed to circulate for some time in vivo. The rats were then anesthetized using 5 % chloral hydrate (0.4 g/kg), and phage-containing supernatant was recovered from the cerebrospinal fluid, amplified by infecting competent bacteria (Escherichia coli ER2738), titered and pooled for the next round of screening. Subsequent screening rounds were conducted by intravenously injecting the newly amplified phage (1 × e12 pfu in 100 μl TBS) and repeating the procedures described above."
ABKS,The real targrt is hexahistidine-tagged recombinant human TNFα (6His-rhTNFα).
ABKT,"To increase the screening specificity, microtiter wells were coated with purified sera IgG from the patients with CHB without HBsAg seroclearance, in order to absorb non-specific phages from the random phage peptide library. The unbound phages were then incubated with the sera IgG from patients with CHB, with HBsAg seroclearance, to screen for phage containing potential peptide biomarkers."
ABKU,"The library was subjected to cycles of selection on SM30 cells. To subtract nonspecific binding phages from the library, the phage library was pre-adsorbed against adult dermal fibroblasts cells before each of selection cycle."
ABKV,"In the second and third round of biopanning, 50 ug/mL and 25 ug/mL IgG were incubated with amplified phages selected in the previous biopanning round, to enrich those phage displaying high-affinity binding."
ABKW,"Prior to p16 selection, non-specific binding phages were removed from phage display library by adsorption of 2ml phage library on blank plates three times."
ABKX,"Prior to selection, non-specific binding phages were removed from phage display library by adsorption of 2ml phage library on blank plates three times."
ABKY,"For round 1, tumor-bearing mice received 2e9 transducing units (TU) of phage peptide library i.v. After 24 h of circulation, the mice were perfused with 10 mM PBS (pH 7.4), and tumors were collected. Soft tissue and bonelike matrix compartments of the tumor were separated physically, weighed, and homogenized for phage recovery. The recovered phage pool was amplified and subjected to another round of selection."
ABKZ,"The ligated left carotid artery is the target for phage display, while the right artery serves as a normal flow control. Four days postligation, in vivo phage display was carried out. Phages were injected into the tail vein of the mice at a concentration of 2e11 plaque-forming units. After 2.5 h, mice were sacrificed by CO2 inhalation, and the carotid arteries were surgically isolated; phages were recovered from the vessels."
ABLA,"After removing unbound phage by repeatedly washing the plate with TBST, bound phage were eluted with 1ml HSA solution (100 mg/ml)."
ABLB,The library was joined and subjected to a first affinity selection with hPK. The second round of panning was performed using neutravidin-coated magnetic beads to prevent the enrichment of streptavidin-specific peptides.
ABLC,"The library was joined and subjected to a first affinity selection with hPK. Isolated phage were amplified and, prior to the second round of affinity selection, treated for 30 min with 5 mg/ml pancreatin. The second round of panning was performed using neutravidin-coated magnetic beads to prevent the enrichment of streptavidin-specific peptides."
ABLD,"The library was joined and subjected to a first affinity selection with hPK. Isolated phage were amplified and, prior to the second round of affinity selection, treated for 30 min with 10 mg/ml pancreatin. The second round of panning was performed using neutravidin-coated magnetic beads to prevent the enrichment of streptavidin-specific peptides."
ABLE,"The library was joined and subjected to a first affinity selection with hPK. Isolated phage were amplified and, prior to the second round of affinity selection, treated for 30 min with 20 mg/ml pancreatin. The second round of panning was performed using neutravidin-coated magnetic beads to prevent the enrichment of streptavidin-specific peptides."
ABLF,"In the second round, neutravidin-coated magnetic beads were used to prevent the enrichment of streptavidin-specific peptides."
ABLG,"In the second round of selection, neutravidin-coated magnetic beads were used to prevent the enrichment of streptavidin-specific peptides."
ABLH,A second round of panning was performed following the same procedure but using neutravidin-coated magnetic beads in order to prevent the enrichment of streptavidin-specific peptides.
ABLI,Anti-LiPA IgGs were coated onto a polystyrene Petri dish overnight at a concentration of 5 μg/mL for the first two rounds of panning and a concentration of 0.5 μg/mL for the last panning.
ABLJ,"Four and three consecutive panning rounds of the phage library were performed, respectively, on control livers and on apoptotic livers."
ABLK,"The libary was incubated (2 h, room temperature) with a preblocked well (in the absence of PS) to remove phages that interact with plastic surface. And then, libary was  transferred to the PS coated well and incubated overnight at room temperature under mechanical agitation."
ABLL,"In the first round of biopanning, inactive MTB reference strain H37Rv was used as the target. For three further rounds of biopanning, Mycobacterium smegmatis was used as the reverse screening molecule with increased stringency of the washing steps. After four rounds of screening, Clones were eluted by H37Rv."
ABLM,"In the first round of biopanning, inactive MTB reference strain H37Rv was used as the target. For three further rounds of biopanning, Mycobacterium smegmatis was used as the reverse screening molecule with increased stringency of the washing steps. After four rounds of screening, Clones were eluted by Mycobacterium smegmatis."
ABLN,"Phage of the library were cyclized by oxidation and then subjected to affinity selections with the model target streptavidin. For the selection of binders to streptavidin, the streptavidin beads (50 μL) were directly blocked."
ABLO,"Phage of the library were cyclized by reaction with TBMB and then subjected to affinity selections with the model target streptavidin. For the selection of binders to streptavidin, the streptavidin beads (50 μL) were directly blocked."
ABLP,"For the uPA selections, neutravidin-coated magnetic beads were used to immobilize the biotinylated human uPA."
ABLQ,"Phages were firstly incubated with HEK293 cells. After incubation, the supernatant containing unbound phages was incubated with the blocked Eca-109 cells."
ABLR,"To eliminate nonspecific binding of phage with BSA, phages were firstly incubated with plate coated with BSA-PBS. After incubation, the supernatant containing unbound phages was incubated with the the plate containing 1C11 MAb. To elute the bound phage, 100 μL AFB1 (100 ng/mL in 10% methanol, competitive elution) was added to each well with shaking for 30 min to compete the binding phage from the coating antibody."
ABLS,"To eliminate nonspecific binding of phage to BSA, phages were firstly incubated with plate coated with BSA-PBS. After incubation, the supernatant containing unbound phages was incubated with the the plate containing 3A5 mAb. To elute the bound phage using competitive elution, 100 μL of thiacloprid (10 mg/L in PBS) was added to each well with shaking for 1 h to compete the binding phage from the coating antibody."
ABLT,"The first, third, and fifth rounds of biopanning were conducted on recombinant human IGF2R protein, while the second and fourth rounds of biopanning were conducted against rat hepatic stellate cells HSC-T6."
ABLU,The conjugate IMI-BSA was used as binding-templates to select peptides specific for imidacloprid. Bound phages in the wells were eluted. The eluted phage solutions were transferred onto wells coated with 3% BSA alone to eliminate the non-specific binding phages.
ABLV,"Following washes of increasing stringency, bound phage were eluted using 100 μM MSCIN-A to specifically select for SCIN-competitive, C3b-binding sequences."
ABLW,"For selection of peptides that bind to the murine monoclonal anti-FVIII antibody (mAb) 2-76 immobilisation on streptavidin-coated beads was achieved via a biotin-conjugated rabbit anti-mouse IgG. For negative selections, an appropriate IgG isotype (murine IgG2a) was used. Three positive and two negative selections were performed."
ABLX,"For positive selections, IgGs from FVIII inhibitor-positive plasma was immobilized on streptavidin-coated beads via a biotin-conjugated goat anti-human IgG. For negative selections, IgGs from a plasma pool of healthy individuals negative for FVIII-specific antibodies were immobilised likewise."
ABLY,"Phages from the library were firstly incubated with BSA. After incubation, the unbound phages was incubated with CD44 protein."
ABLZ,"In the first round of panning, phages were incubated with agarose beads bound with A. vitis polygalacturonase. Beads were harvested by low-speed centrifugation for 30 s, and the supernatant containing unbound phage was removed. The agarose beads were then washed 10 times with PBST and phages were eluted. In the second round, phages were incubated with blocked agarose beads containing no bound polygalacturonase to eliminate target-unspecific phage from the phage pool. The supernatant from this step was used in a second round of panning with polygalacturonase-bound beads."
ABMA,Phages that were bound to TGF-β1 receptors onto peripheral blood mononuclear cells (PBMC) surface were competitively eluted with 10 ng/mL of recombinant TGF-β1 (Sigma-Aldrich).
ABMB,"Phage display library was incubated with ovarian cancer cells (BG1), and un-captured phages were removed by the washing buffer. After five positive selection panning rounds, the positively selected phages were collected and incubated with other cancer cells. Unbound phages were collected and cloned into E. coli cells."
ABMC,"A complete biopanning procedure consists of prenegative screening against blank NTA resin (1 round), positive screening against Cr(III) (3 rounds), and postnegative screening against the other metal species (Iron ion : 1 round, Cadmium ion : 2 rounds, Copper ion : 2 rounds, Zinc ion : 1 round, Mercury ion: 1 round)."
