PPID,Post-processing
AAWQ,"Phages were added to half of the blocked streptavidin magnetic particles. The phage supernatant was then transferred to the thrombin-bound magnetic particles coated with streptavidin and incubated overnight at room temperature. In the first round, phages bound to thrombin were eluted with 50 μl of 0.1 M glycine, pH 2, for 15 min at room temperature and immediately neutralised with 125 μl of 1 M Tris-HCl, pH 8. The titre of the eluted phages was estimated and half of the eluted fraction was used for amplification. Three additional rounds of panning were performed. During this last three rounds, the thrombin-bound phages were eluted with 8 mg r-hirudin (Hoechst-Marion-Rousell, AGS Frankfurt, Germany)."
AAWR,"The p53-binding domains of MDM2 (referred to thereafter as (syn)MDM2) and their site-specifically biotinylated forms were chemically synthesized using native chemical ligation. In fact, biotin-(syn)MDM2 was used as bait against the phage display library. Several MDM2 structures have been determined in complexes with PMI (PDB ID code 3EQS and 3LNZ) and pDI (PDB ID code 3G03, 3JZR and 3JZS). The basic procedures for library screening are as follows: (i) incubate input phage (10 μL) with 400 μL of 10 nM biotin (syn)MDM2 for 60 min before adding phage-target solution to 50 μL of streptavidin-agarose resin (Pierce) for affinity capturing; (ii) wash unbound phage; (iii) elute bound phage with 1 mM (15–29) p53; (iv) amplify the eluate and collect phage for the next round of panning; (v) repeat steps 1– 4; (vi) sequence selected binding clones according to the procedures recommended by the manufacturer."
AAWS,"The p53-binding domains of MDMX (referred to thereafter as (syn)MDMX) and their site-specifically biotinylated forms were chemically synthesized using native chemical ligation. In fact, biotin-(syn)MDMX was used as bait against the phage display library. The basic procedures for library screening are as follows: (i) incubate input phage (10 μL) with 400 μL of 10 nM biotin (syn)MDMX for 60 min before adding phage-target solution to 50 μL of streptavidin-agarose resin (Pierce) for affinity capturing; (ii) wash unbound phage; (iii) elute bound phage with 1 mM (15–29) p53; (iv) amplify the eluate and collect phage for the next round of panning; (v) repeat steps 1– 4; (vi) sequence selected binding clones according to the procedures recommended by the manufacturer."
AAWT,"A 15-mer synthetic peptide ODIN (GREPRVATVTRILRQ) was covalently attached to tosyl-activated M-280 beads by its N-terminal amino group. For counter selection, amplified phage from the first round of selection were incubated with beads coated no peptides. The supernatants were used as input to the second round."
AAWU,Phages displaying a ligand for the biotinylated antibodies are captured on the dish by binding of the biotin moiety to immobilized streptavidin.
AAWV,Phages displaying a ligand for the biotinylated insulin are captured on the dish by binding of the biotin moiety to immobilized streptavidin.
AAWW,"Each selection was performed on the streptavidin-coated (Pierce, Rockford, IL) petri plates. "
AAWX,"Authors identified and isolated phages specific for arthritic joints using a combination of ex vivo and in vivo phage screening. For ex vivo screening, authors used CD31-expressing endothelial cells from the joints of an arthritic rat. Two rounds of ex vivo enrichment produced a phage pool that bound 66-fold more efficiently to the endothelial cells compared with the nonrecombinant phage. The ex vivo selected phage was injected i.v. into an arthritic rat, and subsequent three rounds of in vivo selection yielded a 53-fold enrichment of the phage recovered from the synovial tissue, whereas no enrichment was observed in the control tissues, namely the lung and the kidney."
AAWY,"For subtraction of non-specific binding, the 1.0e9 plaque-forming units (pfu) in 100????l of TBST (50 mM Trisa??a"
AAWZ,"Screening of the phage library was performed by the BRASIL method, which allows the separation of cell-bound from unbound phage in one step. CD4+CD25- cells were used for preclearing."
AAXA,"Since the viruses were harvested from the cells, therefore, a subtract panning was conducted. In the fourth round of panning, the coated viruses were replaced by the supernatant form Madin-Darby canine kidney (MDCK) cells culture."
AAXB,"Screening studies were performed on porcine skin in Franz diffusion cells (FDCs, PermeGear). The phage display library was placed in the donor compartment of the FDC. After 24 h, phage which had penetrated through the skin were collected from the receiver compartment, amplified, and again placed in the donor compartment for an additional round of screening to further narrow down the library."
AAXC,"For the dermis screen, the phage display library was also placed in the donor compartment of the FDC. After 24 h, the liquid from the donor compartment was removed and the skin was placed at 60 °C for 90 s. The epidermis was then removed from the dermis. To extract phage from the dermis, the dermis was cut up into small pieces and then homogenized (IKA disperser)."
AAXD,"The phages were first incubated with the zinc precursor (zinc nitrate solution) at room temperature. Careful selection of the Zn precursors is important for this method. If conventional Zn precursors that form zinc hydroxide solids in aqueous solution are used, amorphous Zn(OH)x might grow in addition to ZnO nanoparticles in the phage solution, and then the panning process could also contain the sequences of peptides that bind amorphous Zn(OH)x nanoparticles."
AAXE,Cercariae was directly used for construction of a reverse adsorption peptide library.
AAXF,"Before positive selections, the library was subjected to negative selection by passage through non-tumor-bearing mice."
AAXG,Hsp70-PCs were obtained from the human breast carcinoma cell line MDA-MB-231 using ADP-agarose affinity chromatography. Phages interacting with the HSP70 moiety of the HSP70-PC were removed using a subtractive biopanning step with recombinant HSP70.
AAXH,Hsp70-PCs were obtained from the human breast carcinoma cell line MCF-7 using ADP-agarose affinity chromatography. Phages interacting with the HSP70 moiety of the HSP70-PC were removed using a subtractive biopanning step with recombinant HSP70.
AAXI,The areas with induced beating cardiomyocytes were selected and trypsinized into single cells for the positive screen; undifferentiated  mouse embryonic stem cells (mESC) were used as the negative screen.
AAXJ,A normal renal cell line HK-2 were used to carry out subtractive screening in vitro.
AAXK,"Microtiter wells were respectively coated overnight with 100ml of purified IgG (100μμg/ml) from each of the control groups. The plates were blocked with 3% nonfat milk for 2 hr, and then washed five times with 0.05% Tween-20 in Tris-buffered saline (PBST). One hundred ?`l of diluted random 12-peptide phage display library with a titer of 1.5e11 pfu/ml was added to coated plates. After sequential incubation for 1 hr at room temperature with each of the control IgG-coated plates, the unbound phages were collected and added 100μl/well into the early HCC-IgG-coated plate. Another two rounds of affinity selection were carried out in the same way, except that 1:200 and 1:400 sera dilution was added to 100μl of diluted phages from the last round."
AAXL,"IFN-a-sensitive KT-1/A3 cells were used as the target, and IFN-a-resistant subline KT-1/A3R was used as absorber for phage display biopanning."
AAXM,"In forth round, the bound phage were eluted with ETGE peptide. MBP and MBP-Kelch(G364C) were used to carry out subtractive screening."
AAXN,"In forth round, the bound phage were eluted with ETGE peptide. MBP and MBP-Kelch(G430C) were used to carry out subtractive screening."
AAXO,"In forth round, MBP and MBP-Kelch(G364C) were used to carry out subtractive screening."
AAXP,"In forth round, MBP and MBP-Kelch(G430C) were used to carry out subtractive screening."
AAXQ,Phages were precleared by incubation for 20 min at room temperature with mouse IgG mAb 6G-2 of unrelated specificity bound to protein G beads. Unbound phages were then incubated with 300 ng of purified mAb 7C11.
AAXR,A-431 cells expressing epidermal growth factor receptor were used as the matrix in a cell-based subtractive biopanning approach using a 7-mer peptide displaying phage library. Human fetal foreskin fibroblast cells were used to carry out subtractive screening.
AAXS,HEK293-E6 cells expressing recombinant human secreted (rhs)CLU were used as the target in a cell-based biopanning approach.
AAXT,"Most solid tumors express the large isoform of TNC which contains EGF domain, fibrinogen glob (fbg) and fibronectin III (FN III) domains with the inclusion of alternatively spliced exons in the middle. Due to the complexity and sizes of the tumor specific TNC protein, the authors utilized two different versions of TNC proteins and performed two independent selections. One is the tumor-specific large isoform of TNC (Full-length TNC) expressed in eukaryotic cells and the other is the alternatively spliced domain (A1-D) of TNC expressed in bacteria."
AAXU,"In the fourth round of panning, the coated viruses were replaced by the supernatant of MA104 culture. The phages were incubated with the supernatant at room temperature for 30 min prior to the fifth
round of panning."
AAXV,Goat IgG were used in a subtractive biopanning approach.
AAXW,Human IgG were used in a subtractive biopanning approach.
AAXX,"In fact, hCXCR1-transfected murine pre-B cells were used to panning the phage library. In each round, bound phage were eluted with hCXCL8."
AAXY,"In fact, hCXCR2-transfected murine pre-B cells were used to panning the phage library. In each round, bound phage were eluted with hCXCL8."
AAXZ,"Prestin was adsorbed to polypropylene Petri dishes, these were used to perform the first two of three rounds of biopanning. The 3rd round of biopanning was performed using Cos-7 cells transiently transfected with a cCFP-prestin plasmid, to eliminate false-positives affinitive to intracellular loops and trans-membrane helices of the prestin that may have been obtained using soluble prestin."
AAYA,"To increase the screening specificity, microtiter wells were coated with purified sera IgG from healthy controls to absorb non-specific phages from the phage random peptide library, and the unbounded phages were then incubated with sera IgG from knee OA patients to screen for phages containing knee OA-specific peptides."
AAYB,Library was cleaned with mAb 17C (anti-gp43) that belongs to the same isotype of the mAb 5E7C (IgG2a) to eliminate non-specific phage clones to the target molecule (mAb 5E7C).
AAYC,"Before each round, libraries were depleted of fibrinogen binders by incubating the phage with biotinylated fibrinogen bound to bead immobilized streptavidin."
AAYD,"In the negative selection procedure, the library was incubated with the synovial cells for 1 h to exclude the synovial cell affinity phage clones."
AAYE,"In the first round, the phage library was incubated with (His)6-DevR immobilized on Ni2+ NTA (nitrilotriacetic acid) magnetic agarose beads. The loosely bound phages were discarded by elution with DevR D54N mutant protein (100μg/mL concentration), which differs from the wild-type protein at the phosphorylation site. A second elution was performed with buffer containing 250 mM imidazole that released the His6-tagged protein along with the tightly bound phages. Three rounds of panning were performed using the twin elutions approach, and each time the phages in the imidazole elution were amplified and used as an input for the next round of panning. The fourth and fifth rounds were performed on plate to eliminate bead binders. The loosely bound phages were\r\nfirst eluted with mutant D54N DevR protein and then with 0.2 M glycine, pH 2.2. In the fifth (final) round of panning, a penultimate elution using phosphorylated DevS was carried out prior to final elution of the bound phages using 0.2 M glycine."
AAYF,One hundred microliters of the diluted phage library was then introduced into the TMX suspension and incubated for 1 h with gentle rocking. The sample was washed several times with TMX-saturated 0.1% TBST buffer and transferred to new centrifuge tubes. This step removed nonspecific binding phage or any phage with a strong affinity to the polypropylene centrifuge tubes.
AAYG,Immobilized recombinant extracellular domain of the epidermal growth factor receptor (EGFR) was used for negative selection.
AAYH,"In the screening, the phage display peptide library was subjected to three rounds of affinity selection. Each affinity selection was done by biopanning on ELISA plate. ELISA plates were blocked with bicarbonate buffer (PH 8.6) containing 50 mg/l streptavidin."
AAYI,"Skin was sandwiched between the donor and receptor compartments with the SC facing the donor compartment. Phages, from phage display peptide library (PDL) were loaded into the donor compartment of the Franz diffusion cell. The donor compartment was covered with parafilm to maintain occlusive conditions. Phage particles that crossed the skin were collected from the receptor chamber after 24 h and were amplified. An amplified pool of phages was loaded again in the donor chamber for another round of screening. In this way, screening was performed three times."
AAYJ,"Lyophilized streptavidin 1.5 mg (Ph.D.-12, BioLabs, New England) was dissolved in 1 mL of 10 mM sodium phosphate (pH 7.2) in 100 mM NaCl. For each target three wells of a 96-well plate were coated with the prepared solutions, i.e., 150μL/well overnight at 4°C under gentle agitation."
AAYK,"For screening, non-specific binding phage was cleared from the library by panning against normal appearing gastric mucosa adjacent to the tumor. Approximately 92.8% of the non-specific phage clones were subtracted from the original phage library after two rounds of biopanning against normal appearing gastric mucosa."
AAYL,"Panning steps of the primary library were performed on 10-mm multiwell plates coated with streptavidin essentially. The target was the 36-PLB-C peptide biotinylated on the cysteine residue. Three enrichment cycles (e12 phage particles used in the first round, then 20% of the volume of the amplified eluates were used in the second and third rounds) were carried out."
AAYM,Human embryonic kidney 293T cells was used to carry out subtractive panning.
AAYN,Phages library were added to the microtiter well adsorbed with negative IgG firstly.
AAYO,"In each round, biotinylated zymogen caspase-6 was incubated with the amplified phage from previous round and the caspase-6-phage complex was captured by NeutrAvidin-coated plate that has been previously blocked by block buffer."
AAYP,"In each round, the phage eluates were added into the microtiter plate coated with normal rabbit antiserum at room temperature and incubated for 1 h. The preincubation procedures were performed 5 times to remove those phages that possibly nonspecifically bind to rabbit antiserum."
AAYQ,A negative selection was conducted with endemic negative serum antibodies coated on magnetic particles.
AAYR,"Tumor was raised by s.c. injection of 1.0e6 BEL-7402 cells per mouse in 200μL culture medium with 10% FCS into the flanks of the nude mice. When tumors reached a size of ∼1 cubic centimeter, phage library containing e11 colony-forming units (CFU) was injected through the tail veins of the mouse."
AAYS,"Control IgM was used in the negative selection, and then unbound phages were transferred to wells coated with LRO4 (positive selection). In the last biopanning round, LRO4-bound phages were competitively eluted with increasing concentrations (3-150 μg/ml) of MDA-LDL diluted in blocking buffer, followed by elution using elution buffer."
AAYT,We first depleted the M13-derived linear 7-mer peptide phage librariy by preabsorbing the library on beads coated with wild-type HIV-1 IN.Phages remaining in the supernatant were used for positive selection rounds with  LEDGF-coated beads .
AAYU,We first depleted the M13-derived cyclic 7-mer peptide phage librariy by preabsorbing the library on beads coated with wild-type HIV-1 IN. Phages remaining in the supernatant were used for positive selection rounds with  LEDGF-coated beads.
AAYV,We first depleted the M13-derived 12-mer peptide phage librariy by preabsorbing the library on beads coated with wild-type HIV-1 IN. Phages remaining in the supernatant were used for positive selection rounds with  LEDGF-coated beads.
AAYW,"e11 plaque-forming units were added on immobilized negative target (EGFR) in 96-well plates. After incubation for 1 h at room temperature, medium containing unbound phages was transferred on the immobilized positive target (PDGFRβ) and further incubated for 1 h at room temperature."
AAYX,"Animals underwent injection of the phage library in 200 ul of normal saline via tail vein at 4h following  30%  TBSA  burn  injury  and  were  compared  to  sham.  One hour  following  injection  of the  phage  library,  animals  were  placed under general  anesthesia  with  isoflurane  and  a  segment of  the  distal ileum  was  harvested."
AAYY,The libraries were incubated with b-βγ subunites that had been bound to immobilized streptavidin on a microtiter plate.
AAYZ,"To screen the positive or specifically binding phages,phage solution were added to the hIgG-coated beads.Before proceeding to the next round of biopanning,non-specific phages that were included in the selected phages were removed by a 'subtraction' step by using magnetic particles without a hIgG coating.The supernatant from this subtraction step was introduced  to the next round."
AAZA,"The phage library was twice depleted of clones binding to E.coli ATCC 700928 and S.epidermidis ATCC 35983,prior to affinity selection of clones binding to S.aureus to ensure  specificty.                                         "
AAZB,"RA retinas was used in the negative selection.The OIR retinas was used in positive selection.

"
AAZC,RA retinas was used in the negative selection.The OIR retinas was used in positive selection.
AAZD,"A patient received an intravenous infusion of the unselected random phage library, and 15 min after infusion tissue biopsies were obtained to provide histopathological diagnosis and to recover phage from various organs. "
AAZE,"A patient received an intravenous infusion of the unselected random phage library, and 15 min after infusion tissue biopsies were obtained to provide histopathological diagnosis and to recover phage from various organs.                                     "
AAZF,"A patient received an intravenous infusion of the unselected random phage library, and 15 min after infusion tissue biopsies were obtained to provide histopathological diagnosis and to recover phage from various organs."
AAZG,"After the first selection, the acid eluted buffer was changed with Herceptin?.
"
AAZH,"
"
AAZI,"Phages isolated during the second round of panning on RA sera were incubated with 100 pg of ammonium-precipitated immunoglobulins obtained from a pool of  40 normal individuals. After panning for 10 min on a plate coated with streptavidin, the non adherent phages (depletion step) were collected. RA sera was used in the positive selection. Ammonium-precipitated immunoglobulins from a pool of 40 normal individuals were used in the negtive selection. "
AAZJ,Phage that bind to the biotinylated mAb B3 were enriched by several cycles of biopanning on streptavidin-coated petri dishes.
AAZK,"Wells of the microtiter plates were first coated with streptavidin, washed with TPBS (phosphate buffered saline, pH 7.4, 0.5% (v/v) Tween-20), and blocked with 3% (w/v) BSA prior to addition of biotinylated antigens. Phages were incubated with antigen prior to washing and elution. In the last two rounds of some procedures, phages were pre-incubated with the biotinylated antigens before the streptavidin capture."
AAZL,"Mice were first anesthetized with Avertin and then injected intravenously (tail vein) with phage peptide library.Organs were then weighed, homogenized, and the phage were rescued by infection with K91kan bacteria. "
AAZM,"Mice were first anesthetized with Avertin and then injected intravenously (tail vein) with phage peptide library.Organs were then weighed, homogenized, and the phage were rescued by infection with K91kan bacteria."
AAZN,Phage specific for GST were removed by immunodepletion with 100 μg of agarose-bound GST after cycles 1 and 2 of affinity purification.
AAZO,The isolated phages were subtracted using NHFs. Recovered phages were subjected to five rounds of MDA167Tu-selection successively. These selections were then followed by three rounds of NHF subtraction in succession. 
AAZP,A clearing step on LZRS-b-gal-transfected hepG2 cells was performed before incubation and recovery from LZRS-LOX-1-transfected cells.
AAZQ,"The bound phages were specifically eluted with fibrillar human collagen type I (100 ????g/ml). After amplification of the phages, two additional rounds of panning were performed."
AAZR,Phage encoding peptides were eluted in the each round of biopanning using PBS and intact PA.
AAZS,"For the ex vivo screening, MDA-MB-435 human breast carcinoma xenograft tumors cell suspension was incubated with the phage library. The phage selection process was repeated 3 times. Then the ex vivo pre-selected phage pool was then subjected to an in vivo selection round by injecting it into the tail vein of a nude mouse bearing an MDA-MB-435 tumor."
AAZT,Three subtractions with HeLa cells before the first selection on WiDr cells. No further subtractions were done before the four next selections.
AAZU,"Three subtractions with HeLa cells before the first selection on WiDr cells, and three subtractions with 293 cells before each of the subsequent four selections on the WiDr cells."
AAZV,"Three subtractions with HeLa cells before the first selection on MDA-MB-231 cells, and three subtractions with 293 cells before each of the subsequent four selections on the MDA-MB-231 cells."
AAZW,Three subtractions with 293 before each of the four subsequent selections on MDA-MB-231 cells.
AAZX,Biotinylated full length eIF4E was loaded onto 10 ml of steptavdin M280 magnetic Dynabeads (Invitrogen). Each selection was performed on the beads.
AAZY,"The library prepared in 500 μl PBS was orally administered into starved male SD rats using an oral zonde, before they were lethally anesthetised after 1 h of retention and again perfused via the left heart ventricle with DMEM supplemented with 1% heparin to remove circulating blood from the organs."
AAZZ,"To screen peptides targeting visceral adipose tissue via transdermal route, male Wistar rats were anesthetized and the hair on the abdominal skin surface carefully removed with an electric clipper. Phage-peptide library prepared in PBS was spread onto the abdominal skin surface."
ABAA,In the first-round male SD rats were anaesthetized and injected intravenously over 30s with 100L of saline containing plaque forming units of the library. The brain-associated phages from this fourth-round output were then injected into another animal for a final  fifth round of in vivo selection. 
ABAB,Bound phages were competitively eluted with α3(IV)NC1.
ABAC,Wells of the microtiter plates were first coated with streptavidin. Biotinylated ErbB-2-ECD was incubated with streptavidin-coated plates. Each selection was performed on the plates.
ABAD,"Prior biopanning on adherent SKBR3 cells, the libraries were pre-absorbed on HMEC and PBMC."
ABAE,Specific complexes originated by incubating mAb with library and secondary antibody at room temperature (RT) for 3 h were immobilized on streptavidin-coated dishes.
ABAF,The phage pool isolated after one round of selection against HT29 cells was subtracted by five rounds of successive incubation with HCT116 cells.
ABAG,Biotinconjugated anti-mouse IgG Fc-specific secondary antibody was pre-adsorbed overnight with M13K07 UV-killed phage particles. Then specific complexes originated by incubating mAb MHM23 with library and secondary antibody at room temperature (RT) were immobilized on streptavidin-coated dishes.
ABAH,"Before incubation with the endothelial cells (ECs) injured by oxidized low density lipoprotein (ox-LDL), the library was pre-absorbed with normal Ecs."
ABAI,The CX7C random peptide library were incubated with antibodies immobilized on protein G from serum. The pre-cleared phage library was then selected on affinity-purifed antibodies from ascites of the index patient. 
ABAJ,Female nude mice carrying pre-established human MTC xenografts following subcutaneous injection of TT cells were anaesthetized with avertin and intravenously injected with input phage library .
ABAK,"After being subtracted with NNM cells three times, the unbound phages were used to react with NPC-TW 04 cells."
ABAL,"The library was added to 293 cells for a negative selection. The medium was collected and centrifuged, and the supernatant was transferred to DU-145 cells."
ABAM, A  Ph.D.-C7C phage display peptide library was injected via the tail vein into tumor-bearing RET-transgenic mice. 
ABAN,"Normal prostate cells were incubated with plaque-forming units (pfu) of T7 phage displaying a CX7C peptide library.After being centrifuged, the supernatant (the normal prostate-subtracted phage library) was recovered and then incubated with cells derived from premalignant prostate tissue or prostate tumor. After subtractive panning, the library was subjected to two to three rounds of in vivo selections."
ABAO,"The phage aliquot was added to physiologic saline, i.v. administered and then infused into the patient."
ABAP,"C57BL/6 mice bearing single, subcutaneous B16-F10 tumors were injected i.p. with the Ph.D.-12TM filamentous bacteriophage phage display peptide library."
