PPID,Post-processing
AAAA,"Phage were incubated with the selection Ab in solution, followed by affinity capture of the Ab-phage complexes onto protein A/G-agarose. In panning, phage bound to resin were eluted with of glycine HCl (pH 2.2) and rapidly neutralized with Tris-HCl (pH 9.1)."
AAAB,"Phage were incubated with the selection Ab in solution, followed by affinity capture of the Ab-phage complexes onto protein A/G-agarose. In panning, phage bound to resin were (nonelution) directly added to a culture of E. coli strain ER2738 for amplification.  Amplified phage were purified by precipitating the phage with polyethylene glycol/NaCl."
AAAC,"Phage were incubated with the selection Ab in solution, followed by affinity capture of the Ab-phage complexes onto protein A/G-agarose. In panning, phage bound to resin were (nonelution) directly added to a culture of E. coli strain ER2738 for amplification. Amplified phage were purified by precipitating the phage with polyethylene glycol/NaCl."
AAAD,The two libraries were mixed and phage reactive to bovine IgG was removed by incubation in tubes coated with purified bovine IgG.
AAAE,"4G2dc1-coated wells were blocked with 5% BLOTTO (milk powder diluted in phosphate-buffered saline [PBS]), and the 20-mer phage peptide library was preincubated in 1% BLOTTO for 15 min to remove any milk-binding phage before being added to the 4G2dc1-coated wells."
AAAF,"In this study, CCR5-expressing CHO cells (CHO/CCR5 cells) were used to select CCR5-binding peptides from a phage-displayed 12-mers peptide library. "
AAAG,The phage library was added to non-bait-coated dishes (those coated with human IL-6Rβ proteins) for preabsorption.
AAAH,"Panning was performed on the surface of a well from a 96-well microtiter plate (Costar, Cambridge, MA)."
AAAI,"In the third and fourth rounds of selection, the library was precleared on the antibody cetuximab (Merck, Darmstadt, Germany). "
AAAJ,"In the third and fourth round of selection, the library was precleared on rituximab."
AAAK,Recombinant full-length human XIAP are used to select peptides from phage display peptide libraries.
AAAL,
AAAM,Osteoblasts were used as the absorber cells for subtraction biopanning from phage display library.
AAAN,"Phage and PAI-1 expressed from HT-1080 cells (100 nM) were incubated in MBS supplemented with BSA and glycerol for 1 h. Formed phage-PAI-1 complexes were captured on polystyrene-adsorbed monoclonal anti-PAI-1 antibody Mab-7 (first and fourth rounds of panning), Mab-5 (second and fifth rounds of panning) or Mab-3 (third round of panning)."
AAAO,"Panning was performed using Dynex Immunolon microtiter wells coated with L. monocytogenes cocktail (15 serotypes or strains, i.e. 1/2a, 1/2b, 1/2c, 3a, 3b, 3c, 4a, 4b, 4c, 4d, 4a, EGD and three EGD Mutant strains). Nonspecific phages were removed by absorbing the phage library sequentially on uncoated wells and wells coated with BSA. Subtractive selection was carried out by the sequential application of L. innocua cocktail and L. ivanovii cocktail to wells with washing between steps. Low-affinity L. monocytogenes-specific phage peptides were removed by rapid exposure and removal of L. monocytogenes cocktail. The wells were washed before incubation with L. monocytogenes cocktail (30 min) to elute specific high-affinity bound phages."
AAAP,Peptides were eluted from a T cell line by 4B4 mAb.
AAAQ,"In fact, the recombinant GST-Grb2 protein is target."
AAAR,"To eliminate clones that bind plastic, the library was preincubated on 10 cm tissue culture dishes for 1 h at room temperature (RT) in DMEM 10% v/v FCS. SiHa cells were grown on 10 cm tissue culture dishes until they reached an 80% confluent monolayer in the conditions mentioned above."
AAAS,Phages were preabsorbed on beads containing immobilized human normal IgG to remove any phages that were not specifically reactive with trastuzumab.
AAAT,"Between panning rounds 1 and 2, a subtractive panning was performed on a blank, blocked polystyrene plate to remove nonspecific plastic binders."
AAAU,Bound phages were eluted for IFN-
AAAV,"In each round, a subtractive panning was performed on normal mouse IgG."
AAAW,"In fact, GST/PKA/SrcSH3 fusion protein is the target."
AAAX,Wild type cells GC9811 were carried out subtractive panning.
AAAY,"In each round, bound clones were sequentially eluted with glycine-HCl, tetrahydrolipstatin, glycine-HCl and tetrahydrolipstatin. Four rounds of biopanning were performed. With the exception of the first round of each selection protocol, only the phages collected in the last elution step were amplified for the next round of biopanning."
AAAZ,"In each round, bound clones were sequentially eluted with glycine-HCl and tetrahydrolipstatin. Four rounds of biopanning were performed. With the exception of the first round of each selection protocol, only the phages collected in the last elution step were amplified for the next round of biopanning."
AABA,"In each round, bound clones were sequentially eluted with glycine-HCl, porcine pancreatic lipase and tetrahydrolipstatin. Four rounds of biopanning were performed. With the exception of the first round of each selection protocol, only the phages collected in the last elution step were amplified for the next round of biopanning."
AABB,"In each round, bound clones were eluted with tetrahydrolipstatin. Four rounds of biopanning were performed. With the exception of the first round of each selection protocol, only the phages collected in the last elution step were amplified for the next round of biopanning."
AABC,"In each round, bound clones were eluted with porcine pancreatic lipase. Four rounds of biopanning were performed. With the exception of the first round of each selection protocol, only the phages collected in the last elution step were amplified for the next round of biopanning."
AABD,"The phage library was first incubated in a well not coated with LPS for 1 h at room temperature, upon which the unbound fraction was transferred to LPS-coated wells."
AABE,"The panning procedure was the same as MS00166, except that an additional incubation step with LPS-O111 was added in each panning, and the unbound fraction was used for panning with LPS-O55."
AABF,Two rounds of panning experiments were conducted: the first with acid elution and the second eluted by LHRH peptide.
AABG,The panning experiments were conducted using the generic acid elution procedure.
AABH,A total of three rounds of panning experiments were conducted: the first two with acid elution and the third eluted by incubation in TBS buffer.
AABI,"Two independent biopannings were performed using the PhD-7 random heptapeptide library (New England Biolabs, Beverly, MA) and IgG from two PBC sera, and three independent biopannings using a mixture of libraries comprising the PhD-7 library, a cysteineconstrained heptapeptide library PhD-C7C, and a 12mer library PhD-12 (New England Biolabs, MA, USA), and IgG from a further three PBC sera. Thus, in all, phage clones were available from five separate biopannings with sera from five patients."
AABJ,Phage encoding peptides were eluted in the each round of biopanning using glycine-HCl.
AABK,"Phage encoding peptides were eluted in the each round of biopanning using glycine-HCl, glycine-HCl and ATP."
AABL,"Phage encoding peptides were eluted in the each round of biopanning using glycine-HCl, glycine-HCl and D-Glu."
AABM,"In the present study, we have designed a biopanning strategy using two tiers of selection: the first on GT1b, and the second on NGF-differentiated PC12 cells. We have also combined different strategies to recover bound phage. In the first tier of biopanning, acidic elution (Glycine-HCl-pH 2.2) was used to capture all GT1b bound phage, then rTTC elution was used to select for phage with binding at the clostridial toxin receptor. In the second tier of cellular biopanning, PC12 cell lysis was used to recover all phage binding to or taken up by the neuronal cell line. Phage was amplified and titered after each round."
AABN,"High liver-metastatic cell variant XGC9811-L was chosen as a tester and its parental cells XGC9811 cell as a depletory. With a subtraction/selection protocol, multirounds of selection were carried out in our experiment. Before each round of selection, XGC9811 cells were used for preincubation with the library in order to remove the non-specific phages. Specific phages binding to liver-metastatic XGC9811-L cells were obtained from the phage peptide library and further enriched round by round."
AABO,"To isolate peptides binding to strain-specific epitopes, we chose to preadsorb the starting library against a nonvirulent NTHi (Rd KW20) prior to affinity selecting for peptides binding to R2866."
AABP,"After the first round of panning, the phages were treated with normal liver cell line HL-7702 in the same way for reverse absorption, and the unbound phages were collected to eliminate the phages which can bind to liver cells. The residual phages were amplified and tittered for next round panning. After three rounds of panning and two rounds of reverse absorption the peptide sequences of randomly picked phage clones were analyzed by DNA sequencing."
AABQ,"The phage library was incubated on four successive cultures of untransfected HepG2 cells in 1ml of biopanning media. Incubation of the library on untransfected HepG2s should effectively remove from the phage population those bearing peptides capable of binding receptors normally expressed on HepG2, thus clearing the phage library of phage able to bind to non-target receptors. Cleared phage library was then panned immediately in duplicate on HepG2-EPCR. Cells were extensively washed, weakly associated phage removed by acid wash prior to recovery of high affinity phage isolated by cell lysis. Four additional rounds of panning were performed including a clearing step on HepG2-beta-gal prior to biopanning on HepG2-EPCR."
AABR,"In the screening, the phage display peptide library was subjected to three rounds of affinity selection. Each affinity selection was done by biopanning on Petri dishes coated with streptavidin. Petri dishes coated with streptavidin were blocked with phosphate buffered saline (PBS) containing 3% bovine serum albumin (BSA) and 0.1 mg/ml streptavidin."
AABS,Bound phages were eluted with glycine buffer.
AABT,Bound phages were eluted competitively by using recombinant Phl p 5a in Hepes/NaCl.
AABU,"For the first three round of panning, Bound phage were eluted using HCl-glycine. In rounds 4, 5 and 6, we applied a consecutive specific elution at neutral pH, which consisted of an
elution with peptide 11 (CDPGYIGSR) in TBS."
AABV,"For the first three round of panning, Bound phage were eluted using HCl-glycine. In rounds 4, 5 and 6, we applied a consecutive specific elution at neutral pH, which consisted of an
elution with mixture of heparan sulfates from bovine kidney and bovine lens capsule in TBS."
AABW,"The library was subjected to cycles of selection on CHO cells stably expressing the CCR5 receptor. To decrease the background of phages binding to other cell surface proteins, the phage library was pre-adsorbed on wild-type (CCR5-negative) CHO cells before each of selection cycle."
AABX,An M13 phage library was injected into the tail vein of cholesterol-fed apoE-/- mice. Internalized phages were retrieved from dissected aortic plaques and then reinjected into subsequent mice for a total of 3 rounds of positive selection.
AABY,Phage selection and negative depletion were performed using strain-matched murine cardiac endothelial cells (MCECs) and murine lung endothelial cells (MLECs).
AABZ,"The recombinant human VEGF165 contained in bovine serum were used for screening. The template is likely to be VEGFR1; however, other possiblities exist."
AACA,"For each round, purified phages in PBS were injected into mouse via the tail vein. One hour later, brains were harvested, rinsed with cold PBS and homogenized for titering and amplification. This way, phages binding to brain microvasculature were enriched. The template of the brain-specific peptide CAGALCYA is surpposed to be a receptor or ligand involved in cell adhesion to endothelium of the brain microvasculature. Screening in vivo has inherent issues of high background, all the more apparent when a high complexity library is administered. The authors suggest there is an upper limit of library diversity of one in 10e5 pfu, if a hit is to be reliably identified by in vivo phage display."
AACB,"Antibodies specific for PBA, were purified on 3-((2-oxoethoxy)ethoxy)phenoxybenzoic acid coupled Sepharose, from serum of rabbits immunized with a hapten-KLH conjugate."
AACC,"The biopanning is performed in parallel on three different groups of endothelial cells: (a) cells incubated under normal oxygen conditions; (b) after 3h of hypoxia; (c) after 24h of hypoxia.
Peptides obtained did not induce VEGF receptor gene expression,indicating the template is not VEGF."
AACD,"Before they were used to screen the library, monolayers of human bronchial epithelial cells (16HBE14o-) were treated with a calcium chelator, EGTA, to increase accessibility to the junctional complex/paracellular space."
AACE,ADAMTS-4 was cloned and expressed in Drosophila Sf9 cells. The purified preparation was composed almost solely of the 70-kDa active form.
AACF,Primary human atherosclerotic tissues were obtained by endarterectomy of three patients with coronary atheroma (50 ± 12 year-old). Cell suspensions were prepared by homogenizing the tissues.
AACG,Primary human atherosclerotic tissues were obtained by endarterectomy of three patients with femoral atheroma (63 ± 11year-old). Cell suspensions were prepared by homogenizing the tissues. 
AACH,Melanin was purified from MNT-1 human melanoma cells.
AACI,"The template of CPLDIDFYC might be Vascular Cell Adhesion Molecule 1 (VCAM-1), since the α4β1 integrin (VLA-4) has been identified as the target of CPLDIDFYC."
AACJ,HCCLM3 has a high metastatic potential. The phage-displayed random peptide library was first screened with MHCC97L which is an HCC cell line with a low metastatic potential. The unbound phages remaining in supernatant were then screened HCCLM3.
AACK,"Cells on culture plates were incubated with the peptide-phage library for 2h at 37°C with shaking every 15min during the round of panning. Following this, the cells were washed 20 times with PBS at room temperature. After washing, the cells were lysed. 100ml lysate was used to infect E. coli and then used in the next round of selection."
AACL,GH680 was covalently coupled to BSA and then immobilized on Nunc Maxisorp plates for selection. A subtraction well containing a BSA-only sample was prepared. The subtraction step was designed to filter BSA-and/or plastic-binding clones.
AACM,"The tumor cells were isolated from tumor xenografts in nude mice prepared using the HT-1376 human bladder tumor cell line. Phage that bound to normal bladder cells isolated from mouse bladder tissues, normal rat kidney cells, or human umbilical vascular endothelial cells were subtracted during the biopanning procedure."
AACN,Mouse anti-human IgG coupled magnetic microbeads were blocked overnight at 4 ◦C in PBS/0.1% BSA (w/v). These beads were then incubated overnight at 4 ◦C with anti-HAV serum and washed four times with PBS/0.1% BSA (w/v)/0.1% Tween 20 (v/v) (PBSB-T). The beads were further blocked with excess of UV-killed wild-type phage M13K07 particles for 4 h at 4 ◦C and then used to screen the library.
AACO,CL1-5 cells (lung cancer cell line) were injected s.c. into SCID mice to produce lung cancer xenografts.
AACP,"PPAR-gamma was expressed in Sf9 insect cells and biotinylated.
"
AACQ,PPAR-gamma was expressed in Sf9 insect cells and biotinylated.
AACR,"The library was first screened against an irrelevant monoclonal anti-digoxin antibody that would not be expected to bind specifically to MUC1-specific epitopes. Additionally, in order to omit those phages that bind to BSA, the library was screened against BSA-coated wells."
AACS,"In fact, recombinant GST-GABARAP fusion protein was used for screening."
AACT,"After the fifth round, all sequenced clones have the same sequence EDIKPKTSLAFR, which might be a candidate as diagnostics and therapeutics for nasopharyngeal carcinoma."
AACU,"Before HBOEC screening, human umbilical vein endothelial cells (HUVEC) were used to remove non-specific binding phages."
AACV,These peptide sequences were obtained when the pH of elution buffer was at 6.0.
AACW,These peptide sequences were obtained when the pH of elution buffer was at 4.5.
AACX,These peptide sequences were obtained when the pH of elution buffer was at 2.8.
AACY,GP (from -813 to -1081) was immobilized on the surface of Streptavidin MagneSphere Paramagnetic Particles. The beads-DNA complex were then incubated with the library.
AACZ,Human rotavirus was cultured in MA104 cells. The purified rotavirus particles immobilized on solid phase were used for panning.
AADA,The normal liver cell line (L-02) was used firstly to carry out subtractive screening.
AADB,"The phages bound to SW480 were treated with normal human intestinal epithelial cells for 2 rounds to eliminate the nonspecific phages.
"
AADC,"S114 (NIH 3T3, transfected with the human genes for HGF/SF and Met) and SK-LMS-1/HGF (human leiomyosarcoma cell line autocrine for human Met and human HGF/SF) cells were used alternately to screen the library. NIH 3T3 cells were used for negative selection to remove nonspecific binders. Thus, the target molecule was thought to be Met. Since the three sequenced clones were able to compete with HGF in a dose-dependent manner, their template should be HGF."
AADD,The human embryonic kidney cell line 293 cells were used for a negative selection.
AADE,"Selection were carried out using the N-terminal 137 amino acids of AtFip1[V] as a target. A search of the Arabidopsis proteome using these Fip1-binding peptides as queries resulted in the identification of a number of putative Fip1-interacting proteins. One of these was the polyadenylation factor subunit, CstF77. This purported interaction was confirmed by yeast two-hybrid and in vitro assays. Mutation of the motif identified in the phage display screen eliminated the interaction, corroborating the results of the phage display screen."
AADF,"Rat plasma was used as adsorbent before the first round. Before the the second and each subsequent round of panning, phages were preadsorbed on rat blood cells."
AADG,"CG1 was selected from hybridomas, which were developed from mice immunized with soluble recombinant human tACE purified from culture medium of CHO cells. Its isotype: IgG1,"
AADH,The template should be gp41 since the mimotopes are similar to CSGKLIC of gp41.
AADI,Human IgG1 Fc was used firstly to remove Fc-binding phages.
AADJ,"After 4 rounds of 4-AAP selection, 2-AAP and 3-AAP were used sequentially to delete those phages also binding to the structural isomers 2-AAP and 3-AAP from the 4-AAP binding pool."
AADK,"The human monoclonal antibody 5145A against HIV-1 gp120 was isolated from an asymptomatic, seropositive hemophiliac. The epitope of this HuMAb overlaps the CD4-binding site of gp120. The antisera from mimotope fusion protein immunized rabbit did not compete with CD4 for binding to gp120, although 5145A is specific for the conserved CD4 binding site region of the HIV envelope protein gp120. Perhaps, the template is not CD4."
AADL,"Recombinant human MMP-9 was immoblized through MMP-9 monoclonal antibody.
 0.01% arabinose was used during phage production."
AADM,Recombinant human MMP-9 was immoblized through MMP-9 monoclonal antibody. 0.001% arabinose was used during phage production.
AADN,Recombinant SERA5 enzyme domain was used for panning.
AADO,SNV was propagated and the titer was determined in Vero E6 cells. The preparation of UV-inactivated SNV was used for panning.
AADP,CRIP1 was digested with enterokinase to remove the His tag and then used as target.
AADQ,Intact colon polyps freshly resected were used as the target.
AADR,"The rhesus monkey was infected with SHIV-1157ip, an R5 SHIV strain encoding env of a recently transmitted Zambian HIV-C. Its polyclonal IgG was immobilized by a rabbit anti-monkey IgG and used as target. Eluted phages were subjected to negative selection using pooled sera from non-infected control monkeys."
AADS,Laser capture microdissection (LCM) is performed to separate only cancer cells as the target used.
AADT,Human normal large intestinal mucosal epithelial cells were used to remove non-specific phages to LoVo cells.
AADU,CHO cells transfected with full-length Cldn-4 (CHO-Cldn-4) were used as the target. CHO control cells were used to remove phage specific for CHO determinants in the 2nd and the 4th round.
AADV,"In the motif, X is preferably a hydrophobic amino acid. The pooled phage libraries were screened with HEK293 cells transfected with hFcRn and hβ2m (293c11) by using competition with hIgG to select for phage capable of interfering with the IgG–FcRn interaction at pH 6. The subtraction step was performed twice by incubating the phage with the untransfected 293 cells."
AADW,Heptamer sequences isolated from biopanning in buffer.
AADX,Heptamer sequences isolated from biopanning in 50% acetonitrile (ACN).
AADY,"In fact, the recombinant fusion protein HSA-FcγRIIa was used as the target. However, HSA-binding phages were removed using human serum albumin. For each round, panning parameters were wrote as (target) {wash} [elution]. Round 1, (100μg/ml HSA–FcγRIIa){nil}[0.1 mg/ml IgG]; round 2,(5μg/ml HSA–FcγRIIa){nil}[0.1 mg/ml IgG]; round 3,(5μg/ml HSA–FcγRIIa){nil}[0.1 mg/ml IgG]."
AADZ,"In fact, the recombinant fusion protein HSA-FcγRIIa was used as the target. However, HSA-binding phages were removed using human serum albumin. For each round, panning parameters were wrote as (target) {wash} [elution]. Round 1, (100μg/ml HSA–FcγRIIa){0.1 mg/ml IgG}[10 mg/ml IgG]; round 2,(5μg/ml HSA–FcγRIIa){0.1 mg/ml IgG}[10 mg/ml IgG]; round 3,(5μg/ml HSA–FcγRIIa){0.1 mg/ml IgG}[10 mg/ml IgG]."
AAEA,"In fact, the recombinant fusion protein HSA-FcγRIIa was used as the target. However, HSA-binding phages were removed using human serum albumin. For each round, panning parameters were wrote as (target) {wash} [elution]. Round 1, (100μg/ml HSA–FcγRIIa){nil}[0.1 mg/ml IgG]; round 2,(5μg/ml HSA–FcγRIIa){0.1 mg/ml IgG}[1mM DTT]; round 3,(5μg/ml HSA–FcγRIIa){0.1 mg/ml IgG}[1mM DTT]."
AAEB,"In fact, the recombinant fusion protein HSA-FcγRIIa was used as the target. However, HSA-binding phages were removed using human serum albumin. For each round, panning parameters were wrote as (target) {wash} [elution]. Round 1, (100μg/ml HSA–FcγRIIa){nil}[0.1 mg/ml IgG]; round 2,(100μg/ml HSA–FcγRIIa){nil}[0.1 mg/ml IgG]; round 3,(100μg/ml HSA–FcγRIIa){nil}[0.1 mg/ml IgG]."
AAEC,"In fact, the recombinant fusion protein HSA-FcγRIIa was used as the target. However, HSA-binding phages were removed using human serum albumin. For each round, panning parameters were wrote as (target) {wash} [elution]. Round 1, (100μg/ml HSA–FcγRIIa){nil}[0.1 mg/ml IgG]; round 2,(100μg/ml HSA–FcγRIIa){0.1 mg/ml IgG}[1mM DTT]; round 3,(100μg/ml HSA–FcγRIIa){0.1 mg/ml IgG}[1mM DTT]."
AAED,"In fact, the recombinant fusion protein HSA-FcγRIIa was used as the target. However, HSA-binding phages were removed using human serum albumin. For each round, panning parameters were wrote as (target) {wash} [elution]. Round 1, (100μg/ml HSA–FcγRIIa){0.1 mg/ml IgG}[10 mg/ml IgG]; round 2,(100μg/ml HSA–FcγRIIa){0.1 mg/ml IgG}[10 mg/ml IgG]; round 3,(100μg/ml HSA–FcγRIIa){0.1 mg/ml IgG}[10 mg/ml IgG]."
AAEE,MALDI-TOF mass spectrometry following immunoprecipitation assay showed that a potential template for the peptide CTLPHLKMC is a variable region of human immunoglobulin heavy chain which would be a specific phenotypic marker of Raji.
AAEF,"In fact, the target used in the experiment is a chimeric protein composed of the N-cadherin ectodomain fused to the immunoglobulin G1 Fc fragment. The bound phages were eluted through adding 100 ml TBS containing 2 mM EDTA to each well and incubating for 10 min at room temperature with constant agitation."
AAEG,"In fact, the target used in the experiment is a chimeric protein composed of the N-cadherin ectodomain fused to the immunoglobulin G1 Fc fragment. The bound phages were eluted through adding 100 ml 0.2M glycine HCl to each well and incubating for 10 min at room temperature with constant agitation followed by neutralization with 1 M Tris-HCl, pH9.1 (20 ml/well)."
AAEH,Tetragonal BaTiO3 powder (99.9% purity) was used as the target.
AAEI,"The Ph.D.-C7C library was orally administered into overnight-starved, 12-week-old male Sprague-Dawley (SD) rats. After 1h retention, rats were sacrificed and phages from four representative organs (liver, lung, spleen, and kidney) were eluted and amplified for next round of panning. After the third round of biopanning, total 850 peptide sequences were determined from randomly selected individual phage recombinants from four representative organs, liver (from which 220 peptide sequences were identified), lung (218), spleen (204), and kidney (208)."
AAEJ,CsaA from Agrobacterium tumefaciens (AtCsaA) was biotinylated and used as the target. The initial library was incubated overnight with the streptavidin magnetic beads to remove streptavidin binding phage.
AAEK,"The Ph.D.-7 library was orally administered into 2 Swiss albino male mice weighing 25g. One hour later, phages passed through the intestinal barrier was evaluated by investigating its presence in the samples prepared from spleen. Statistical treatment of the obtained sequences did not support the notion that the GI translocation depends on the presence of any particular peptide sequence fused on the pIII coat proteins of the M13 phages."
