PPID,Post-processing
AAMM,"The primary library was panned for two rounds using MAb 4G10, after which the eluate was amplified and panned for one round with MAb 5A10."
AAMN,"The primary library was panned for two rounds using MAb H50, after which the eluate was amplified and panned for one round with MAb 9C5."
AAMO,"The primary library was panned for two rounds using MAb 9C5, after which the eluate was amplified and panned for one round with MAb H50."
AAMP,"The phage library was incubated with 911 human embryonic retinoblast cells for 1 hour at 4℃. Then medium containing unbound phage was removed and discarded. Finally, phage bound to cells were specifically eluted by the addition of FGF2 (in PBS) to each well with gentle agitation."
AAMQ,"The phage library was incubated with 911 human embryonic retinoblast cells for 1 hour at 4℃. Then medium containing unbound phage was removed and discarded. Finally, phage bound to cells were specifically eluted by the addition of FGF2 (in PBS) to each well with gentle agitation."
AAMR,"At each round, phage particles binding to isotypic and allotypic determinants of mAb HC-10 were removed by a preadsorption step on mAb HC-10 isotype-matched mAb W6/32."
AAMS,"Biopan the phage library on differentiated Calu-3 cell monolayers, the membrane associated phage were degraded by proteinase K digestion and the internalising phage were protected from intracellular degradation by the endosomolytic compound chloroquine, amplified from cell lysates and used in the next round."
AAMT,Each library was incubated with MOLT-4 leukemia cells for 30 minutes on ice to deplete background and common cell surface binding phage (pre-clearing).
AAMU,"RG2 cells were grown to a sub-confluent monolayer. First, an aliquot of the primary library in washing/blocking buffer was added to an empty flask (depletion flask) to remove plastic-binding phage clones. Buffer containing phage that did not bind to plastic was transferred to the flask with RG2 glioma cells for incubation. After that, phage not associated with tumor cells were washed away. Cell-surface bound phage were recovered with low pH elution buffer."
AAMV,"RG2 cells were grown to a sub-confluent monolayer. First, an aliquot of the primary library in washing/blocking buffer was added to an empty flask (depletion flask) to remove plastic-binding phage clones. Buffer containing phage that did not bind to plastic was transferred to the flask with RG2 glioma cells for incubation. After that, phage not associated with tumor cells were washed away. Cell-surface bound phage were recovered with lysis buffer."
AAMW,"RG2 cells were grown to a sub-confluent monolayer. First, an aliquot of the primary library in washing/blocking buffer was added to an empty flask (depletion flask) to remove plastic-binding phage clones. Before incubation with RG2 cells, preselection steps with fibroblasts, myoblasts, and hepatocytes were included in the protocol to remove phage binding to these normal cells. Phage associated with RG2 cells were recovered from a single flask with elution buffer."
AAMX,"RG2 cells were grown to a sub-confluent monolayer. First, an aliquot of the primary library in washing/blocking buffer was added to an empty flask (depletion flask) to remove plastic-binding phage clones. Before incubation with RG2 cells, preselection steps with fibroblasts, myoblasts, and hepatocytes were included in the protocol to remove phage binding to these normal cells. Phage associated with RG2 cells were recovered from a single flask in two sequential steps, first with elution buffer and then with lysis buffer."
AAMY,"In fact, isolated mitochondria from the MA-10 mouse Leydig cell tumor line, which express high amounts of PBR, was the target. In biopanning experiments, PBR-interacting phage peptides were eluted using either PK 11195 or Ro5-4864."
AAMZ,"First-round affinity selections were carried out in four polystyrene 24-well dishes. Wells were coated with streptavidin. The second round was carried out in four 96-well ELISA dishes. A key difference was that neutravidin was substituted for streptavidin to capture Bio-IgG molecules. The third round of affinity selection was like the second round, but streptavidin was substituted for neutravidin."
AANA,"The recombinant Hap46 was immobilized on Petri dishes, blocked, and incubated with phage library following the manufacturer's protocol. To eliminate enrichment of phage clones interacting with the plastic surface or the blocking agent, the following two strategies were employed: (i) eluted and amplified material from the first panning was either subjected to a preadsorption step on bovine serum albumin coated Petri dishes prior to subsequent pannings, or (ii) bovine serum albumin as blocking agent was alternated with casein in the form of dried milk powder."
AANB,"The recombinant Hap46 was immobilized on Petri dishes, blocked, and incubated with phage library following the manufacturer’s protocol. To eliminate enrichment of phage clones interacting with the plastic surface or the blocking agent, the following two strategies were employed: (i) eluted and amplified material from the first panning was either subjected to a preadsorption step on bovine serum albumin coated Petri dishes prior to subsequent pannings, or (ii) bovine serum albumin as blocking agent was alternated with casein in the form of dried milk powder."
AANC,"Phage library, diluted in PBS, were injected into the umbilical vein through the catheter."
AAND,"In fact, CCR3-transfected murine pre-Bcells were the target. Bound phage were first specifically eluted by competition with excess of eotaxin."
AANE,Before applying phage display library to htop(1-214) prepanning step was performed with albumin (100µg/ml) as a target.
AANF,"The phage library was pre-incubated with an irrelevant mAb (IgG1, kappa) for 30 min and then added into the well coated with anti-JL1 mAb."
AANG,"First, a pre-clearing step was used to remove nonspecific clones by pre-absorbing the phage peptide library onto purified IgGs from normal serum pooled from volunteer agematched blood-donor control men. Next, the pre-cleared phage library was selected onto the pool of IgGs purified from the serum of prostate cancer patients."
AANH,"In fact, chimeric P-selectin, consisting of human IgG1 fused to the binding domain of human P-selectin (PS-IgG), was the target."
AANI,"For the second and third rounds of screening, the phages were preincubated with rat IgG (100 μg/mL) to decrease non-specific binding. "
AANJ,"For each selection, 5 microgram of CSF IgG were immobilized using magnetic beads coated with goat anti-human IgG Fc-specific Ab. Eluted phages were subjected to immunological screening using the same CSF as probes."
AANK,"B-B2 was produced by ascitic fluid and purified on a protein A column. Coated mAb was used to select the phages which were then eluted with an acidic treatment, and amplified in bacteria for the next round of selection. After the third round of selection bound phages were eluted by adding the selecting mAb as competitor."
AANL,"B-B2 was produced by ascitic fluid and purified on a protein A column. Coated mAb was used to select the phages which were then eluted with an acidic treatment, and amplified in bacteria for the next round of selection. After the third round of selection bound phages were eluted by adding the selecting mAb as competitor and then acidic conditions were applied to recover the remaining phages."
AANM,"B-B4 was produced by ascitic fluid and purified on a protein A column. Coated mAb was used to select the phages which were then eluted with an acidic treatment, and amplified in bacteria for the next round of selection. After the third round of selection bound phages were eluted by adding the selecting mAb as competitor."
AANN,"B-B4 was produced by ascitic fluid and purified on a protein A column. Coated mAb was used to select the phages which were then eluted with an acidic treatment, and amplified in bacteria for the next round of selection. After the third round of selection bound phages were eluted by adding the selecting mAb as competitor and then acidic conditions were applied to recover the remaining phages."
AANO,Phage particles were incubated with biotinylated alpha-chymotrypsin in pH 6.5 buffer. Streptavidin-agarose (50 μl) was blocked with 20 μl 50 mg/ml dialyzed BSA in TBS for 60 min and added to each of the three selection vials.
AANP,Phage particles were incubated with biotinylated alpha-chymotrypsin in pH 7.0 buffer. Streptavidin-agarose (50 μl) was blocked with 20 μl 50 mg/ml dialyzed BSA in TBS for 60 min and added to each of the three selection vials.
AANQ,"Phage particles were incubated with biotinylated alpha-chymotrypsin in pH 7.5 buffer. Streptavidin-agarose (50 μl) was blocked with 20 μl 50 mg/ml dialyzed BSA in TBS for 60 min and added to each of the three selection vials. The oxidized form of the synthetic peptide CCFSWRCRC, selected at pH 7.5, could completely inhibit the enzymatic activity of alpha-chymotrypsin. The structurally related enzymes trypsin (bovine) and elastase (porcine) were only marginally inhibited by the same peptide under the same conditions. "
AANR,"After the first round of positive selection, there was a negative selection step in which phage not specifically reactive with the monoclonal antibody used for selection were removed using magnetic beads coated with anti-mouse immunoglobulin."
AANS,"The pFc' fragments of a humanized IgG1 monoclonal antibody were generated by digestion with immobilized pepsin. These pFc' fragments were separated from F(ab')2 fragments by affinity chromatography. The pFc' fragments corresponding to the constant region of the humanized anti-Tac (HAT) IgG1 monoclonal antibody were used as targets for panning. EPIHRSTLTALL was the best peptide, which had a binding capacity of 320 mg HAT/g gel in affinity chromatography of HAT."
AANT,The pFc' fragments of a humanized IgG1 monoclonal antibody were generated by digestion with immobilized pepsin. These pFc' fragments were separated from F(ab')2 fragments by affinity chromatography. The pFc' fragments corresponding to the constant region of the humanized anti-Tac (HAT) IgG1 monoclonal antibody were used as targets for panning.
AANU,"The receptor binding domain of human VEGF (residues 8-109) was overexpressed in Escherichia coli inclusion bodies, purified, refolded and used as the target for panning. Sequencing of representitive clones yielded a single consensus sequence."
AANV,"The receptor binding domain of human VEGF (residues 8-109) was overexpressed in Escherichia coli inclusion bodies, purified, refolded and used as the targetfor panning. Sequencing of representitive clones yielded two predominant sequences."
AANW,"For the hexapeptide library,  complexes between 2H1 and phage were captured with streptavidin-coated magnetic beads (Advanced Magnetics, Inc., MA)."
AANX,"For the decapeptide library, complexes between 2H1 and phage were captured with streptavidin-coated magnetic beads (Advanced Magnetics, Inc., MA) and a biotinylated anti-mouse IgG1 antibody."
AANY,"Briefly phage (3e9-9e10 plaque forming units, pfu) in 100 ml PBSTG (phosphate buffered saline containing 0.05% Tween 20 and 0.5% goat sera, Seralabs) were incubated with or without biotinylated equine IgG for 5h at 37°C. An equal volume of M-280 streptavidin-coated magnetic beads (Dynal), washed three times with PBSTG, was added, mixed and stored at room temperature for 5 min."
AANZ,"Phages were incubated serially with monocytes, T cells, and B cells, then with Langerhans-like DC, then MDC."
AAOA,"For library selection, streptavidin magnesphere paramagnetic particles (SA-PMPs; Promega Cat. #Z5481) were rinsed three times with Tris-buffered saline (TBS; 50 mM Tris-HCl, pH 7.5, 0.15 M NaCl). Biotinylated SH3 (100μg) was added to 0.6 mg SA-PMPs in 600 μL TBS and incubated at 4°C for 18 h. The SA-PMPs were then incubated with 10 μmole of biotin at 4°C for 4 h to block unbound sites. The library phage virions (input = e12 cfu) were added and incubated with the beads in 700 μL TBS at 4°C for 18 h."
AAOB,The library was mixed together and added to a well preblocked with nonfat dried milk in PBS. And the library was incubated for 1 hour at RT prior to transfer to GST-M2-2-coated microtiter wells.
AAOC,Peptides were eluted unspecifically by low pH.
AAOD,Peptides were eluted by affinity with the same HMG-box used for the biopanning.
AAOE,"A cardiomyoblast cell line, H9C2, was incubated with a M13 phage 12 amino acid peptide display library. Internalized phage was recovered, amplified and then subjected to a total of three rounds of in vivo biopanning where infectious phage was isolated from cardiac tissue following intravenous injection."
AAOF,"To exclude non-specific binding, we used the differentiated ES (dES) cells and primary mouse embryonic fibroblast (PMEF) cells, a feeder layer for the maintenance pluripotency of embryonic stem cells, as a control. Each round of biopanning included three subtraction steps with dES cells, three ubtractions steps with PMEFs and then a selection step with ES cells."
AAOG,"During each round, the library was preincubated with IgGs purified from normal serum pooled from five healthy volunteers and immobilized on Protein G Sepharose 4 Fast Flow (GE Health care, Uppsala, Sweden) to remove nonspecific binding clones. After the preclearing step, the phage library was selected onto the pool of IgGs purified from patient serum."
AAOH,"The phage-display library was ubtracted twice against C.jejuni strain ACM 3393 in 3 ml PBSg in a Petri dish, prior to being added to C.jejuni strain C338. Non-binding phages were washed away using PBSg as the wash buffer. Cell surface bound phages were recovered with a low pH elution buffer and amplified by infection in E.coli K91BlueKan cells and used in subsequent rounds of affinity selection. In the second and third rounds of affinity selection, non-binding phage were washed away with PBSg."
AAOI,"The phage-display library was ubtracted twice against C.jejuni strain ACM 3393 in 3 ml PBSg in a Petri dish, prior to being added to C.jejuni strain C338. Non-binding phages were washed away using PBSg as the wash buffer. Cell surface bound phages were recovered with a low pH elution buffer and amplified by infection in E.coli K91BlueKan cells and used in subsequent rounds of affinity selection. In the second and third rounds of affinity selection, non-binding phage were washed away with TBST."
AAOJ,"The phage-display library was ubtracted twice against C.jejuni strain ACM 3393 in 3 ml PBSg in a Petri dish and an extra round of subtraction was carried out against C.jejuni strain C338, prior to being added to C.jejuni strain C338. Non-binding phages were washed away using PBSg as the wash buffer. Cell surface bound phages were recovered with a low pH elution buffer and amplified by infection in E.coli K91BlueKan cells and used in subsequent rounds of affinity selection. In the second and third rounds of affinity selection, non-binding phage were washed away with PBSg."
AAOK,"Since direct surface immobilization of target proteins can lead to partial denaturation, an affinity capture method was used, immobilizing the recombinant catalytic fragment (rTcdA540) to Ni-NTA resin. A preclearance step was performed prior to +each round of panning to remove plastic and Ni2+ binders from the phage pool. The biopanning protocol was specifically designed to identify those phage that bind rTcdA within the substrate binding pocket by requiring direct competition with RhoA."
AAOL,"In order to enrich for phage binding to CD4i epitopes, two negative selections were performed, one with MLV/89.6 in the absence of sCD4 and one with sCD4 alone. Each round of positive selection was followed by two consecutive negative selections."
AAOM,"Melanoma B16F10-Nex2 cells were used as an affinity matrix for selection of C7C random peptide phage library, and the melanocytic melan-A cell line was used for unspecific phage depletion."
AAON,The output phage from the third round were used as the input for the fourth round without amplification.
AAOO,Bound phages were competitively eluted from the well with recombinant duck IL-2.
AAOP,"Plasma IgG was linked to magnetic microbeads coated with an anti-human IgG. Three rounds of positive selection were performed. The negative selections and amplifications followed the first and second rounds of positive selection. After the third positive selection, individual colonies were picked at random and subjected to analysis by phage capture ELISA."
AAOQ,"To avoid non-specific binding peptides, differentiated mouse ES cells were used as negative target."
AAOR,"To remove phage clones that bind to the plastic material of test tubes, the primary library was added to an empty test tube prior to incubation with oocytes."
AAOS,Sera from non-immunized animals were used as negative control. Phages bound to IgG were sequentially eluted by competition with recombinant tick subolesin ortholog proteins.
AAOT,Sera from non-immunized animals were used as negative control. Phages bound to IgG were sequentially eluted by competition with recombinant mosquito subolesin ortholog proteins.
AAOU,Bound phages were competitively eluted with recombinant goose IL-2.
AAOV,"Human Embryonic Kidney (HEK) Cell were transfected with GlyR α1 subunit cDNA. Phage were applied to blank (control) HEK 293 cells. Then, phage that did not bind in this negative selection procedure were removed from the plate with a pipette, applied to the plate of GlyR-expressing cells."
AAOW,"Before each selection round, a negative selection with the 293T human embryonic kidney cell line was done to subtract phages that bound to nontumor cells."
AAOX,"Phage library was pre-exposed to extracts of liver and kidney, tissues that typically have high nonspecific uptake of drugs and imaging agent, to allow cleavage by proteases contained within these extracts. Isolated phage were reamplified and subjected to six additional rounds of both negative (no liver/kidney cleavage) and positive (tumor cleavage) selection, with representative phage being isolated and sequenced after each round."
AAOY,"DR1 molecules were isolated from the human EBV-B cell line, HOM-2. M13 phages were incubated with biotinylated DR1 in binding buffer (50 mM Tris-C1, pH 7.5, 150 mM NaC1, 1 mM EDTA, 1 mM PMSF, and 0.2% NP-40). After at least 24 h incubation at room temperature, BSA-blocked streptavidin on 4% beaded agarose was added and incubated for 10 min. The M13 phage/DR1 complexes were purified by washing the solid phase several times with binding buffer."
AAOZ,"The library was biopanned against a chimera of mNdst1 consisting of the full-length protein minus the cytoplasmic tail and transmembrane domain fused to protein A. mNdst1 was immobilized on IgG beads, and heparin was used to displace bound phage."
AAPA,Peptide selection was performed using phage display by removing nonspecific binders using Q-hTERT (intestinal metaplasia) cells and achieving specific binding against OE33 (esophageal adenocarcinoma) cells.
AAPB,"At the final round, bound phages were eluted by addition of excess amount of Bcl-2 protein."
AAPC,"Prior to the phage display, the InN surfaces were preliminarily prepared by appropriate chemical etching; thus, native oxides have been removed assuring the specific phage to reach the SC."
AAPD,Phage selection was performed with an excess of the competing Arg-Gly-Asp (RGD) synthetic integrin-binding peptide motif to minimize and eliminate the recovery of RGD-containing ligands.
AAPE,"For subtraction, the eluted phage solution was incubated with cells from normal tissue and then the supernatant containing unbound phages was recovered."
AAPF,Negative panning was performed to remove the phage particles displaying peptides capable of binding to the monocultured Caco-2 cells.
AAPG,"The library was precleared of phage that bound to the vasculature and other non-tumor antigens in normal non-tumor bearing CF1 mice, and then utilized in an in vivo selection scheme in PC-3 human prostate tumor-bearing mice."
AAPH,"The first three-rounds identified apical cell-surface binders, while the 4th round aimed to identify phage internalised by the ATI-like cells."
AAPI,"The powder was exposed to the phage library, after which the powder was washed repeatedly to remove any free phage particles. The bound phage were then eluted by incubation glycine-HCl solution."
AAPJ,"In fact, the target is Tie2-Fc."
AAPK,"To ensure a high level of the drug absorption on polysterene, doxorubicin was conjugated to BSA, and the conjugate was immobilized on polystyrene ELISA plates. Displacement with verapamil, a competitive inhibitor of doxorubicin binding with P-glycoprotein were used to elute the phages that bound to the doxorubicin-BSA2-coated plates."
AAPL,"To ensure a high level of the drug absorption on polysterene, doxorubicin was conjugated to BSA, and the conjugate was immobilized on polystyrene ELISA plates. Treatment with low-pH buffer which is usually used for phage panning were used to elute the phages that bound to the doxorubicin-BSA2-coated plates."
AAPM,"In fact, the target is recombinant glutathione S-transferase(GST)-CRN-His6."
AAPN,"Duplicate samples of unmodified h31 on magnetic beads were employed for selection. For each sample of unmodified h31, 100 isolates were sequenced. Two hundred phage isolates were sequenced after the fourth round of selection against unmodified h31 on streptavidin-coated beads. "
AAPO,"Duplicate samples of h31 on magnetic beads were employed for selection. For each sample of h31, 100 isolates were sequenced. Phage isolates were sequenced after the third round of selection against wild-type modified h31 on streptavidin-coated beads."
AAPP,A separate counter selection was also carried out in the third round of selection against wild-type h31 in which free unmodified h31 was added to the phage and modified h31-streptavidin mixture.
AAPQ,"Panning was done both with gliadin dissolved in urea and in NaHCO 3. Since electrostatic binding of the phage to the target protein weakens with increasing ionic strength, which in turn influences the specificity of the interaction, different buffers with different ionic strengths were tested prior the actual panning experiments."
AAPR,"In last round, the HAP binding phages were simultaneously exposed to the HAP target substrate in solution."
AAPS,"In the selection against MBP, phage expressing a library of peptides were selected through multiple cycles for binding to biotinylated MBP, using avidin agarose to isolate selected phage. Specifically, the phage library was mixed with biotinylated MBP and allowed to bind for 1 h. Avidin agarose was added and incubated for an additional hour. Nonbinding phage were removed by washing the agarose three times with PBS solution and the supernatant was plated for titer and amplification for subsequent cycles."
AAPT,"Specifically, for positive selection using nerve tissue, nerve tissue was dissected/washed and mixed with a phage library. For negative selection using nonnerve tissues, nonnerve tissues (muscle and fat) were dissected from normal mice and incubated with the phage library obtained from the positive selection. "
AAPU,The first two rounds of bio-panning were performed against ischemic left  ventricular (LV) tissue.
AAPV,"The blocking strategies with bovine serum albumin (BSA) were deployed, and eluates treated with acid were used."
AAPW,"The blocking strategies with bovine serum albumin (BSA) were deployed, and eluates treated with acid/salt were used."
AAPX,"The blocking strategies with bovine serum albumin (BSA) were deployed, and eluates treated with glaycosaminoglycan (GAG) were used."
AAPY,"The blocking strategies with phosphate-buffered saline with Tween (PBS-T) were deployed, and eluates treated with acid were used."
AAPZ,"The blocking strategies with phosphate-buffered saline with Tween (PBS-T) were deployed, and eluates treated with acid/salt were used."
AAQA,"The blocking strategies with non-fat milk (NFM) were deployed, and eluates treated with acid were used."
AAQB,The library was pre-absorbed with the total immunoglobulin G (IgG) mix of 10 healthy donors to remove the phages recognized by the IgG.
AAQC,Purified IgG of health people serum was used as the molecule of counter selection during the second and third selection.
AAQD,"Biotinylated ConA (bio-Con A) at 2μM in Tris-buffered saline (TBS) was incubated on streptavidin-coated polystyrene Petri dishes, for a total of four rounds of biopanning."
AAQE,"In the first round, biotinylated ConA (bio-Con A) at 2μM in Tris-buffered saline (TBS) was incubated on streptavidin-coated polystyrene Petri dishes. The samples of amplified phage were subjected to remaining rounds of biopanning at 0.2μM bio-Con A."
AAQF,"In the first round, biotinylated ConA (bio-Con A) at 2μM in Tris-buffered saline (TBS) was incubated on streptavidin-coated polystyrene Petri dishes. The samples of amplified phage were subjected to remaining rounds of biopanning at 0.02μM bio-Con A."
AAQG,Ad2 penton was immobilized by adsorption to pre-coated penton base antibody.
AAQH,"Elution was carried out by competition with the natural ligand of penton base, soluble wild-type full-length fiber (fl-fiber)."
AAQI,"Elution was carried out by competition with the natural ligand of fiber, soluble penton base (pb)."
AAQJ,Binding was conducted at 4 ℃ and the phage were eluted from the cell surface with acid.
AAQK,"Binding was conducted at 4 ℃. The cell were incubated with acid, then scraped from the plate and spun in a vortex mixer. This cell-associated fraction was recovered and amplified."
